path	sentence	sentence_id
common_voice_mn_20087976.wav	Энд саяхан хүмүүсийг булсан байна.	6bf316ed22ed657f6caddcf7573bc99febe22aa48d041d95b47785fa93d60d38
common_voice_mn_40572110.wav	Над шиг итгэлгүй зарим нэг үзэл бодолтой нь эвлэрч чадахгүй болчихвол тусгүй байх.	f40991f5539f624c01970c80c4953286a2d175623bc2866bb4ee6ca8a1a93b69
common_voice_mn_18577295.wav	Түүнийг нармайгаа нам цохиулж тэр чигт тоохгүй орхисон далий хамар нь л гутаажээ.	29ce7efd9493b92773efbd3869f880d46747b4d9c0df151d2320c69398df0427
common_voice_mn_18578083.wav	Харин навчных нь оронд алтан зоос ургана.	3b3ee2ec7571514e6e988c91d4241f2757f396c7c414aea7eba524654bffef3f
common_voice_mn_40433634.wav	Муж улсуудын хилээр бараа чөлөөтэй нэвтрэх боломжтой болох нь шинэчлэлийн нэг давуу тал.	6c32977253d75fc5ef94a45fddacd0e6b32991960290a0f2e9627d674d47bc49
common_voice_mn_23835658.wav	Ямар ч тохиолдолд тэр бээр Бурхан багшийн сэтгэлийг даган олон түмнээ залж чиглүүлэх билээ.	e0deaf4405256b6f0121f917a5f5fac47afe34b10ac0f5f19c241c371939971a
common_voice_mn_18692528.wav	Харин эдгээр нь бас гол төлөөлөгчийн онолын нөлөөтэй холбогдож болох юм.	94174dab14d2ffc0abff97fe0b66f21fcfd77545b5868c8ac7959e02daf6d868
common_voice_mn_23409626.wav	Тогтсон үзлийг эвдэгч хэмээн тус банкны ядуурлын судалгааны ахлагч Франсиско Ферреира уг судалгааг үнэлэв.	3ce4d8417869e862fcc3a72418677d511bbadee106b5ec2920e9946ceb0ba95d
common_voice_mn_30735830.wav	Чиний санаа зовоод байгаа шиг юм болох ч үгүй.	08f20282672fcad611b5d5271056b95b3c1d3c0bec691e61ebc3bbd012bacab5
common_voice_mn_18577934.wav	Бөртийн яаж тарчилж байгааг Чингис хаан мэдэрч байв.	74852582ca64005950ca1eab1e529dc62b66f6c41f01a0febd2ee4a04579c54e
common_voice_mn_18584025.wav	Хурмаст хааны хоёр чоно ирээд нисдэггүй бор морийг нь идчихээд явчхаж гэнэ.	34390cfb888d03c73b0a4b9569014b646c6ed8ec59cdf3195e91a94f1ef08936
common_voice_mn_37772499.wav	Харин одоо би танаас ганцхан зүйл хүсье.	27ad9b8f4c914abb40e7d6094ab880ced589afb2f42b8c73a9b39424d1762eca
common_voice_mn_37317564.wav	Хотын дээгүүр утаа униар суунаглан, авто хөдөлгөөний нүргээнт чимээ хаа нэгхэн сонсогдоно.	f983336855a198ed6552e260449d93d6139d7d2e931401071601886214e15da7
common_voice_mn_18909839.wav	Малчид тохиролцоод өвөлжөө бууцаа ашиглах хэрэгтэй гэсэн зөвлөмжийг орон нутгийн удирдлагуудад өгчээ.	726c9ef19ae806f75290808d4a0a594d37476a322048b0a3f8aa27e79e76b1a3
common_voice_mn_18605948.wav	Гэтэл Хайнзан гэртээ ч орсонгүй, уяан дээрээсээ шууд мордон хатируулж одов.	0e51d4808ea1edfdd69a4108c1933cfe6b421dc047abbec7d3b273fa3fdcc8b6
common_voice_mn_18585845.wav	Ээж ч мөн гал тогоонд орж ирэхдээ зогсож намайг харж байлаа.	865bf5d897c139b1061ccd978d60509bb1c10d59406030f203ed27e99a54a36b
common_voice_mn_18594955.wav	Бидний ажилд хятадууд ч оролцож байв.	8566061da96b9722f3407ce6330f483db8d09a4804317fb1ad0b00383015812e
common_voice_mn_40555151.wav	Хэрэв би эхнэрээсээ салахгүй бол цаашид яах вэ?	a1ff650167ee863f93d58772e3a8b873e6791c607797cf5990b215a682d5c97a
common_voice_mn_18578285.wav	Чамайг мөнгөнд умбуулж хайраар дутаахгүй гэж согтуу хүн шиг үглэнэ.	5fa7db86810156cd0ee3da9978192ea0fdd9e27d4073b139bdbd84e368f193bf
common_voice_mn_20584956.wav	Гараа бүсэлхийн дээрээ тавин өвдгийг бүсэлхийний төвшинд хүргэж өргө.	9527907e9899f6b0e7e6e918031e948bca1affed0f8cbeb9bfc0b8bbc8155074
common_voice_mn_37290453.wav	Хугацааг тавдугаар сарын арван зургаанаас эхлэн тооцох хэрэгтэй.	17e529f6b3f8942c0ac5bf368c32b6a8c5bb5110ed95f62c82a2d05e36f6249c
common_voice_mn_18581687.wav	Дамбий өвгөнийд хавийн улс цуглаад бөөн шуугиан хөөрөөн болж байв.	94a778138717e5c971414203aa8c1bf9f39461fa10e42442b38045f243f5b484
common_voice_mn_19489793.wav	Бид монголчуудыг сайн мэдэж амжаагүй байна.	5206f18c8787755e11e0c642d7a82663c01bc3ebb73a47fa8258a5a2f6fe69f7
common_voice_mn_25016169.wav	За тэгье хэмээн тэрбээр хариуллаа.	ec309abf4798b8348dc85dca51d3a581bba174b25274320d4e276f63ec86faac
common_voice_mn_21823010.wav	Бүсгүй түргэн хөдөлж зурвасыг гарт нь шидлээ.	e265e9c3a0a5aa812bd27ec376fcef2256ed77e8058d8d092cce2e31ba8358c5
common_voice_mn_18959332.wav	Сүүлийн үед л зарим дүүргүүдэд бичил номын сан байгуулж эхлээд байна.	91d53e17c08532cf12978ce123d6eb1da8fb75cc49b73f017c33114d234e18af
common_voice_mn_18580698.wav	Аливаа нэг хүн худал ярьж байгаа эсэхийг би тодорхойлж чаддаг уу?	227575394316d7be4cb41a118ae341c7407cffbfccf52b67e9b70b0a22daa9ff
common_voice_mn_21823036.wav	Хүйтэн зэвсэг барьсан этгээд автобусны буудал дээр байсан нэгэн эмэгтэйн аминд хүрэв.	d5a0fa87fd263b713d1997fbfd85c5ea0c33146316d5be27e2d5aa06394a7f66
common_voice_mn_18604135.wav	Байртай болох хүслээ биелүүлэх ганц боломж ипотекийн зээл болоод байх шиг байна даа.	07065c55f0e28a47bb11ce81e3466a04e76bd4eca9d0ae5a443046c43f0c8b25
common_voice_mn_40526754.wav	Энэ үед Гэрийн онгон тэднийд орж ирэв.	3219835d22598e22fa3c5172b06fa3555b52a50927dab4a9603c0d7138571f57
common_voice_mn_18578473.wav	Тиймээс өөрийн яриаг хүргэх тал дээр анхаар.	23148946434b6335db86f507a79d92b41caaaa387ef1aa9255086ef98d09ee83
common_voice_mn_18578012.wav	Хэрэв Скарлетт хасаг тэрэгнээс буувал тэр ч бас буугаад дэргэд нь алхана.	06d9bafaf38786d98d93b6c48a772a1459c89e6abd68e28f7a8c2f3077f679c5
common_voice_mn_18587224.wav	Энэ хооронд найзад минь заримдаа залуугаа хардах удаа ч гардаг л байж.	3514819958e9b066849c260e359767463d1d329632f4fa13ba733e1b1b6d80a2
common_voice_mn_18578001.wav	Энэ утгаараа бид олон улсын стандартыг дээдэлж, барихыг ихэд эрмэлзлээ.	388a28aa2a3620708d35edd59446a75d3d0377d83bcb759523b9df92b3176c2d
common_voice_mn_18959334.wav	Украйны Оксана Малаяа гэдэг нохойтой өссөн охины тухай мэдээлэл интернэтэд бий.	7eb7e8e5a194bedb410131a12cc07368134e8c3c85d624da64ed649eb80b0207
common_voice_mn_18577524.wav	Эд ямар хүүхнүүдийг бүрэн байна уу гэж гэрээр нь орж бүртгэх биш.	2114bed314e2682d969e336a08b783e62048d177d7bfa161016eb7c82bdd1c39
common_voice_mn_23398218.wav	Хүүхдийн хэргийн туршлагатай мөрдөн байцаагч өндөр ур чадвар гаргажээ.	ec450cc76d7fd2a3959b330d5a45821b4383fada44024994af7a168735a087e7
common_voice_mn_18674787.wav	Оросыг уулгалан дарж, морьдын туурайн доор газар шороо цуст балчиг намаг болон гишгэгджээ.	774e5b5f54727608d293a6a81b08cfc4e46c8bae6c8ea7b8d6370df97c709373
common_voice_mn_40572158.wav	Хэл ороод босож ирвэл аюул гэдэг тэр.	e9bca79145f09971194c6faf11aa7b388263d28f910b5c9c6c37ab6b7e57a937
common_voice_mn_18571411.wav	Сайн ч мөрдөгч бас шилдэг дарга байсан юм шүү.	0fa9f23a39d358fb48c02c0256bbb6631a495ec198b0865bdfbf453eec6a768a
common_voice_mn_18604786.wav	Үнэрлэдэг морьтнуудын тухай та нарын яриа бүр санаа зовоочихлоо.	fb6a235ed0945a0492da054c17df0a7bd53d23222d331aeee4b0688100085351
common_voice_mn_37319600.wav	Бид бүгд тэр замаар явна гэж би бодсон.	03b8b9dc8ef56a01738f0368b46425bf1d4aa8283c112e318b0084f52b6a80fa
common_voice_mn_32069080.wav	Өдөрт нэгээс хоёр машиныг л авч чадвал дээдийн олз.	c3943a711588938c272de71b2923b697300d1141756103a3deba2e392554eadb
common_voice_mn_35051400.wav	Учир нь чиний амжилтыг бусад хүмүүс бүтээж байдаг.	0a40bc0be4c2430747e9095c55452b123c6fe5ab0c2b0dc21bd1c361865430e8
common_voice_mn_40534934.wav	Тэнд мастерууд гар хумхилгүй хөдөлмөрлөж байлаа.	a06810f58cd8f42ac059671d5e04899cb7f0136da3ecc2c75d94c27239280b74
common_voice_mn_18702812.wav	Нэгдүгээрт нь чамд ямар муу зуршил байна?	5cffa074f6515a22b91948dd3d84cb7a89ee8a8248a3ac849bd7a9a670cdb61e
common_voice_mn_18577294.wav	Харин надад бол ч хэцүүхэн үйл дээ.	2090e35451f151d12bd8cd5d6949f1b58845b190102c95db3f18fe15a948ebb7
common_voice_mn_19020698.wav	Бусдаас хуулахдаа хэлбэрийг нь дуурайгаад, агуулгыг нь орхидог жишиг энд давтагдсан хэрэг.	b535f7761aa504dc8142145071376d14b8b8681d8f22674aea8591332abf0e6c
common_voice_mn_18578278.wav	Одоогийн залуус юутай сайхан том том биетэй вэ?	1200a738f6580213c7c861cb7d9e405e8e4f27f197fde361a7e5dbc34509dd3f
common_voice_mn_18580851.wav	Энэ бол дайн гэдэг үгнээс үүдэн төрсөн анхны аймшиг түгшүүр дэлдсэн сэтгэгдэл байсан ажээ.	165568fcb64a27507bf681d55de07a326735712b4d291f61f9c3c01caeb0a62e
common_voice_mn_18580846.wav	Яагаад бүгдийг хайрлах албатай юм бэ?	98a12a783fb5fef5067be84b10dacb6c37539b7f4e5630ca203c48315fbadc34
common_voice_mn_40006045.wav	Хамт яваа хоёр залуу маань ч бидний ярианд татагджээ.	52fe3c8bc940123183601e665b48c7ab4f143ee8402afa4aee47100966cc9132
common_voice_mn_18987604.wav	Гавшгай шалмаг нь хэвээрээ, орой ачаагаа ян тан болгочхоод шөнө хагаслаад хөдөлдөг юм гэв.	3434ef26e439a240172b939c8f2d1ff0c5baeb1dc2de90632d5d4b3f44b9c84f
common_voice_mn_20919687.wav	Гэтэл арай том энэ цагаан нь юу байдаг билээ дээ гэж хачирхсаар дөхөж очив.	ca31a3f380703f3eff9940951694a80b1a3fa4d4f80d8c38c765971943d7fd2f
common_voice_mn_18584522.wav	Хуучны орос лифт тул байнга гацдаг байсан юм.	84c0b5ca49083c4a8e4c0dac7970883527ec0ffb4b2492d60a9c353858b45703
common_voice_mn_21822993.wav	Тэртэй тэргүй бид ил цагаан газар бүслэгдсэн юм чинь.	d8e51a86bac83c83f4a85974c79151fbeb292d0e5381817fdf86ced8768b1a17
common_voice_mn_40554596.wav	Тиймээс үйлчлэгч хүний хувиар биш харин хувь хүний хувьд таны бодлыг асууж байна.	868a15169bf9c811666ea5f9c81fc90eb954f4481cce9743180d04844524c456
common_voice_mn_18667730.wav	Ямар ч цацрагийн болоод химийн эмчилгээ ч хэрэглээгүй шүү.	b49b114f0c902cc9f8ad8e56f15ad506f6b697c539e5d1b2564edc6a8eea744b
common_voice_mn_18577510.wav	Харилцаа гэдэг бол бүх зүйлийн суурь гэж би боддог.	20fe9c7fea9de4bd4a3edd2fd5d789c597720309213813dfdb631ae7765fedab
common_voice_mn_18583931.wav	Шарын шашны Монголын түүхэнд гүйцэтгэсэн үүргийг шинээр авч үзэх хэрэгтэй байх аа гэж бодогддог.	6569a0601a76d5727de918bf28f37e76d3c8b1db01c2a20245e47f8c3b6e1935
common_voice_mn_18598268.wav	Бараан өнгийг нар шингээдэг учир өвлийн улиралд сонгон хэрэглэдэг бол зундаа бараан өнгөнөөс татгалздаг.	cf304c81792fe76fde2435ed35ebab7ad003092e86d9aa52e68373a595263d51
common_voice_mn_36413381.wav	Нийгэм маань замбараагүй байгаагийн бурууг бид өөрсдөөсөө хайх хэрэгтэй.	fa45334b8177b330a7cfac7f18ddb24e734aa611cc08919864128a311e4e4709
common_voice_mn_18580290.wav	Хөмрөгийн жишээнд Канадын парламентын илтгэл, европын парламентын илтгэлийг дурдаж болно.	b618a7ad62df2508cc582dbe3f97ebce4d0d83a10fab1fa86c76f37dbe479394
common_voice_mn_28790478.wav	Үнэндээ түүний сэтгэлд улаан тоос манарсан шуурга дэгджээ.	e57ff4ef0252a354b32606e90fb72bb6e363d4e1ab75cd1e7ff852a9178d6684
common_voice_mn_40006048.wav	Сайн байна уу	94d989fae4334b00d7e75bcc9d10274639607cd79c63648515a29d454fff8cf7
common_voice_mn_32069062.wav	Бид ажлын шинэ чиглэлийн талаар ярилцсан.	0dbcf967661c2aba9f9829ce7ca03ca5010cfec39d334f930b57ecb812d88227
common_voice_mn_18961056.wav	Энд яригдаад байгаа шинэчлэл гэдгийг шинэтгэл гэж томьёолбол зүйтэй мэт.	159c503fbeb9a8c99c6a57ff399fad7e40239ba825f897268019442a9cdddc38
common_voice_mn_18725039.wav	Тэд хоцрох юм биш явж л байна биз.	abd80e2ee8ca40392e55fe247f254e20aebe82aa43a14ea5f360cfbf2d6865e5
common_voice_mn_40332528.wav	Эрх баригчид шилжилтийн үед бензин-цахилгаан гибрид технологи чухал гэдгийг хүлээн зөвшөөрдөг.	cac0d9e74383a6d086fd50488880a3d2a8efacdfcb7e44a3c10173c0ba0f8e07
common_voice_mn_19513298.wav	Программ бичвэрийг өгүүлбэрээр нь задалж, толь бичигтэйгээ тулгаад, сэжигтэйг нь тэмдэглэж, өөр хувилбарыг харуулна.	63adebc272e4a576a11a6382bc5f3286c8b57fb7a81c2c205a3febbce8d2de55
common_voice_mn_40443082.wav	Намайг заримдаа их аашилдаг, харин аавыг ирэхээр их сайхан зантай болдог гэв.	7f1e35003b1bfd09e5d8e2c76f4ef3e95c8ff188ed3e0b8e8fa69609197687ce
common_voice_mn_20087820.wav	Баяжуулсан гурилыг жирийн нэгдүгээр гурилын үнээр борлуулж байгаа билээ.	4c2131460a01a7ad44d45c5322cd4f8afbd619f86a25a4a8a43637035de63306
common_voice_mn_40328630.wav	Зарим хүүхэд сэтгэл шимширсэн бололтой санаа алдав.	b9656ca986fecb3cc60c09086ab83707ddc226f6a6048d7b2edceda9806093ed
common_voice_mn_40556313.wav	Чи цаг ямагт айлддаг шигээ мадаггүй үнэнийг айлдлаа.	baa765acfbb2428682698580fcd3ae260ed09eb2372fa5a45f852f30534a1041
common_voice_mn_18597957.wav	Ах чинь хэдэн настай юм бэ?	d45b5f01d0f3b2ce5bb8a38f003ec2a7cb5f1ec484a5220f5c50757e0e4302e5
common_voice_mn_18577285.wav	Аз дайрахад чи ганцаархнаа цасны ус хайлуулан уудалж байв.	01c171b8ef23d2ff2fa0ea4cf58d90c644d8db37d84d815ca72be7c257d7a131
common_voice_mn_19521607.wav	Ой ч хүрээгүй нялх хүүхэд манайд байгаа шүү дээ.	6b6f44fde72fae320d98ab3a4a570735d3e0b2c13c3e912eec28d574550191a7
common_voice_mn_18989009.wav	Дэрийг түшиж амттай унтахаас өдөр хэрэг үгүй.	084502a48882089b5692aeda44d0e49f53a817a992b6b4190130cf77605c6213
common_voice_mn_18580681.wav	Гэвч тийм юм хэзээ ч болсонгүй.	b687924f1df6913eead08334f33db292ece371b45ea34ca8f26f3c99601f1184
common_voice_mn_20889955.wav	Нэг удаагийн ярилцлагадаа байгальд их дуртай тухайгаа ярьсан байдаг.	c32f8fe106433602302b6c3a4714280566c614996aa058656058254ec85c9953
common_voice_mn_32069065.wav	Өөр ямар ч санаа надад алга.	fa36c90875e6de46b5e0b54fca2b2b7d7070a57def7b44cf17000b474a2bdcc5
common_voice_mn_18605946.wav	Би танаар хүргүүлэх гэж буцаж ирлээ.	fef430503e8d62b8e1534969563b95516052656e7dacc888e6093a0a056575bf
common_voice_mn_20957280.wav	Дайны талбар дээр өдөр болгон шахам адал явдал угтана.	ab4e87cc173c1f38bc662b7df0b962e4b891e5aeebcffc49bee65d1ae839e705
common_voice_mn_40447094.wav	Хоногийн тоо нь гүйцээгүй л бол хүн гэдэг долоон голтой чөтгөр.	c6f4f5c23b249b3d44ff477cbd00eda335ac805a01a97ab5b68bd703353d5221
common_voice_mn_18988932.wav	Хүн гэдэг сургуульд орохын төлөө мөн ч овжин хөөцөлдөх юм.	fedd5c8aaf3c0a72afb413768a27f883f17e611507599f4d94afe98d57effd53
common_voice_mn_18725075.wav	- Надад захиа орхиогүй юу гэж би зоримогхон асуув.	875abc4c19844ca1841b73c08254ba5838988176ab8973d7ab29eef56a89c79f
common_voice_mn_40328472.wav	Буш бүх зүйл нь төгс байх албагүй компанит ажлыг мөрдөх маш энгийн аргатай.	bf71514234f7d1dfbfb9661aeac26f7f01e3f9dc0a0a9ed454d341bcb03154e1
common_voice_mn_31721212.wav	Ийм нэвтрүүлэг бүтээгчид сонсогчдыг татаж, орлогын шинэ эх сурвалж бий болгохыг зорьж байна.	04b033c4cfdf70a23b3110be54bcb23a1e4333c0a6cebc4c8f19e8e80dd3d445
common_voice_mn_18577362.wav	Даланзадгадын дулааны цахилгаан станцын төслийг учир мэдэх олон хүн муу төслийн жишээ болгодог.	06732e66c53636e257ba28369c46d0ee68f688d612c27888fd993308cfb27693
common_voice_mn_18724951.wav	Гэр тойрсон морьтой хүмүүс багш залууг одоохон хүлэгтэй нь чирээд гаргана.	3110be3169892c207c3e554a489a02a34e42c53e51209e77cb0d945b6943fce2
common_voice_mn_18598938.wav	Одоохондоо ч би хамтран явахад хамгийн сайн нэгэн биш дээ.	e04eae9aad7a39add52e1bf20647cf9b44549da50eaa7dc42fbf2b76b1f3003e
common_voice_mn_18674553.wav	Түүнд орвол сүүлчийнхээ зоосыг архинаас өгсөн нь дээр!	639b64eabd9370eb4d93baaf4528111a0fdfdaf35448df7c3433059cbcefcee3
common_voice_mn_18577517.wav	Байдал хэцүү байгааг бүгд ойлгож байлаа.	37063619e51e8e53d914275e6b5582417d98683c18e5a1afdb83c8af62ee10d7
common_voice_mn_18577244.wav	Эдгээрээс хамгийн сайныг сонгоно гэдэг нь шийдвэр гаргалтын эгзэгтэй үе байдаг.	25480f559b0311138987e10309ebb391a502669f086a0950052544dbc7c4a61d
common_voice_mn_18980751.wav	Эмч бүсгүй чухам энэ мөчид ер бишийн буурь суурь суусан юм шиг харагдав.	299b9cdabbd50585b5bf61797e5ab7971f3321b68f73078d60ac050d2135429e
common_voice_mn_40555436.wav	Би түүний худал хуурмагийг тэр даруйдаа олж харсан.	a292748fb01780cf1f9c70ee107cfcce2c6783a3737923f70f50e81fe4a4bd28
common_voice_mn_18598097.wav	Лалын ертөнцөд тулгарсан ноцтой гурван бэрхшээлийг Индонезийн дэд ерөнхийлөгч Юсуф Калла хөнджээ.	881bd694c508ed95c9c919a58113365e832860ee23a08d80cceaa38a63cbc80c
common_voice_mn_18580706.wav	Ирэх хаврыг би тэсэн ядан хүлээж эхэллээ.	40be11bed7077bd8e475bee62fe525cbe08d65d659f27456d72d21cbd854e167
common_voice_mn_40571210.wav	Ноднин ийм нэг егзөр өвгөн хашаан дээр тун сүрхий ажилласан юм гэж хэлэв.	c971c2a7331effcc532b4422070bb81325b8d3c201839027837ff7365334c22d
common_voice_mn_18580849.wav	Энэ номыг барин үдшийн бүрийгээр өлзийтэй бүхнийг бодон, гэр мал, хотоо тойрдог заншилтай.	414f06c44a4c1b4fde2c0c22d84e223330d9c7b5edc408154ee78890265d7003
common_voice_mn_40574095.wav	Тэгээд тэднийг явуулж байгаад чинь баярлалаа.	f7784e4327d3f03c66eb65a6e712d6a2502b9f07d90901a2764007b9bfb43d0c
common_voice_mn_18630501.wav	Аав ээж хоёр нь тэднийг чухам юу хийж идсэнийг сайн ойлгосонгүй өнгөрөв.	15d4a310bc0dc6ee165c527d1cac9150d20fb751088cf390c3969205f14e3f9f
common_voice_mn_18577481.wav	Яах гэж амттайхан өвсөө хаях вэ дээ?	47bdcd0202de8cb17531ec2dc6df9d6e22e379a4482279be63467f015f756398
common_voice_mn_40592006.wav	Удаан алхахлаар миний хөл өвддөг.	532fbbe6b9eb9df249468da613f44c37b176fe7eac723771843788474e846194
common_voice_mn_20641063.wav	Удалгүй Саранг сургуульд орсон гэж дуулаад баярлалаа.	80da3200c523e54c64cd8cfeb57ad48d04b6c799a169ca788f8295790c49c2ab
common_voice_mn_20889991.wav	Гэвч энэ нь энгийн л зүйл.	afc32ed8f2618b8613cf5468d392c50708321da33a5e17dc88b23db15dc9050e
common_voice_mn_32142263.wav	Сониноо алдаад солигдсон хуучин эхнэр сонин байна уу?	df27efe62a8e961e908060ba00b50ea6f33d0a87d87166409fbe2ff8ff24fdb4
common_voice_mn_18601250.wav	Харин голио царцааны шаагих дуу хүч авч бүх орчин тойрныг эзэмдэх шиг санагдана.	e86cd8d3c67f3da17d550ada80481ef8a9f99b5336d55e8cbd92ea12751ef6cf
common_voice_mn_18988941.wav	Тэрээр дөрөөн дээрээ боссоноо мориныхоо бүдүүн гуянд ташуур өгөн цогиулав.	f5b363b113f2e6722426e070cffb707b4a40b9e06719b81cffbb66226fd064c7
common_voice_mn_40573601.wav	Лхүндэв гуай дараахан нь ангийнхаа улцан цагааныг малиндуулахаар шаргач гүүгээ уначихсан хөтөлж явж билээ.	ef9a5f4ec90a48ff88e0e0d8bbfeb7c10ec484bfbd0744df7167ef297edf69c9
common_voice_mn_18725040.wav	Хааяа нэгхэн, хашааны завсарт хүрч, Чүлтэмтэй жаал жуулхан ярилцсанаар сэтгэлийг бяцхан хуурна.	942e9922b4f6a91aa8ce3a3ef5ed57bea9da36a469edc138b1ea55e92940ff81
common_voice_mn_18580568.wav	Сүм хийдийн бус шашны байгууллагуудын зорилгыг доорх байдлаар тодорхойлж болно гэж үзэж байна.	91aa5c4059e7cee4d3efe02438a4f797dad7f30853b4d758e6f6cc16589066e1
common_voice_mn_26210592.wav	Боломж бол сайн зүйл байна!	0048a1ef87aa64837ab09f99a28378ddba8ae4a246e0475eca549438e92b0c54
common_voice_mn_31437307.wav	Өөрөөр хэлбэл, монгол бичгийн юникодод цаг хугацаа гэдэг хамгийн том шалгуур болоод байгаа.	f4af65f285fd91490b2cb9723904a3b272da8f4a45ce19509acecc54aad1dd16
common_voice_mn_40550172.wav	Шөнө нь хүү унтсангүй ээжийгээ манаж хэвтэв.	5c40309934e7c6325ea11e3de6146b0f236dac15d665c2d020804679558187fe
common_voice_mn_18578208.wav	Чи ч гэсэн тийм л байлгүй.	35b11611e0c6c0b21656369caeb3431136a988ca223cf0f2b5217bfc642bc557
common_voice_mn_40586969.wav	Энэ бол дорнын гүн ухааны сэтгэлгээ юм.	a6dad984e62b102489ee005153b40b36cd5c2a89eb96cc57b6aab06237b8cc03
common_voice_mn_18578225.wav	Эдгээр санаа бодлоос ангижраад бүхнийг оюуны гэрлээр гийгүүлбэл алив юмс ариун утгатай болно.	1c6ed5d39662252cb297704f9e4e48409ca30a9d4e4110e622879ab7496b0087
common_voice_mn_35625928.wav	Энэ бол шалтаг биш гээд өөрөө задалж эхлэв.	0d3e249b7601646682348b0c8b0a7cbefd6051343ed5eee82304dfff1c4e1485
common_voice_mn_25442969.wav	Дасүн номыг адуун сүрэг өсгөх, мөн адууны өвчин эмгэгийг арилгахад айлтгуулна.	ea873ee038a658235fb73b7f5ff5d591f4b6b06eedc7187af0ae902ee69a44db
common_voice_mn_18667728.wav	Өөр хэн нэгэн таны нөхөр байсан бол би ингэтэл харамсахгүй байсан.	62a1193c9a5370dbf93e80e7307c860ed853eaf3f8829173b466a488d7ba6de4
common_voice_mn_20177263.wav	Олонд эмчлэх увдистай ургамал гэдгээрээ танигдсан саримсны ач холбогдлыг шинжлэх ухаан ч баталсан ургамал.	6bd61194b5752bec321c4b5c2b2947b556c9b6d9daa1afd122a4516e82e0e6bf
common_voice_mn_20808433.wav	Хүмүүсийн чанга чанга ярих дуулдан өргөн замын хаа сайгүй шалбааг тунарчээ.	b3730be7ef64156051afdf13cd16f25cc07da306614fa5cc530c6e51e6cf87de
