path	sentence	sentence_id
common_voice_mn_18987432.wav	Социалист байгуулалтын үнс нурман дээр хаягдчихаад зовлон туулж дэнжгэнэсээр босоод ирлээ.	f327353de644ab9fe5b8119fd533f09ed1a7c6a75044a0b5fc861f64dc98fedb
common_voice_mn_18960955.wav	Хэдэн өдрийн дараа дахин ийм байдалд орохгүй, өөрийгөө анхаарна гэж амлаад гэртээ эргэн ирлээ.	0e7a75cb93617415a5ce2711ba29f529baf616639f99e494ce48c9bd1fcba27a
common_voice_mn_19513742.wav	Алтан намар түмэн үзэсгэлэнгээ дэлгээд, бүхий л зүйл боловсроод юутай сайхан.	3a4a44b6d84c0ca189df85bf96c01ec19f21ef3cc5334834eaf5b8f1b2167171
common_voice_mn_18963267.wav	Яаж хувцас тааруулж хийх юм гэж уурлаад дахин хийж өгсөнгүй гэнэ.	8b9b7d082ce94392ecc8cf52a00d14b09eded7e858107e1d7e8e8733118c7e7a
common_voice_mn_18578558.wav	Тус хуулиар галт зэвсэг эзэмшиж буй этгээдийн хадгалах, хамгаалах хариуцлагыг нэмэгдүүлсэн аж.	034fbb8706b29f935e5000bd34740fb896b2c6da316f884676832618c014f2ab
common_voice_mn_18697580.wav	Чамтай энд тааралдана гэж бодсонгүй шүү.	91acf0382bd5710cd91cb3c29653856cf1a21c02bc4abe3b95d67b90c30f5ee0
common_voice_mn_19489789.wav	Ашгүй Хүрлээ явж би ч уйлахаа болив.	54383fda40d55c805a9c713b5b862d18ca240430e3cba4033764bdc0f6135df5
common_voice_mn_40576993.wav	Одоо бид хаашаа явах вэ?	7824385a25f778c685ef155a5951b16ab885b39cd927db23001ae25454d055f7
common_voice_mn_40570366.wav	Хотод суух болсон гэхээр Саран маань яасан их баярлах бол.	c534768632d71a6d9a8cbc2a1681f4fc20b1317a4ea553c9160b47e6688fa9a4
common_voice_mn_19513740.wav	Нөгөө ертөнцөд ч яаж харах юм.	57487b743014d9d5a822bde70dbd5e604ebfc2c1bcd5aef97e140779628c1a0c
common_voice_mn_40534636.wav	Бүх юм бүтэж амар сайхандаа жаргадаг төгсгөл зөвхөн үлгэрт л байдаг шүү дээ.	c0346ca5f2439d5ba6242cf82edf7b6a69c2881e7922f94cbdb477f57f0ab3c3
common_voice_mn_18959882.wav	Би хэнээс ч юуг ч гуйж яваагүй.	f690c869df61bc9aaf22f66855f2bafb0382b108819bdd1647ee2fa1f89fbd69
common_voice_mn_18725061.wav	Эрийн гурван наадам гэхээ өөрчлөх болжээ.	586fa8ee4dbb25edae1b2ed5f47d6db88d7c0cef7f4bc863e1045cda98df3f09
common_voice_mn_23904628.wav	Тэгээд сүүлийн арваад жил нүүрс утгах, түлээ мод хагалахыг ч мартаж төсөөрсөн билээ.	de6dbca15bf2eb70f5e032701167b23ea23e86464912fb27cdce15f553d8ad9c
common_voice_mn_40426746.wav	Эдгээр ажлын бэлтгэл явцад хяналт тавина.	2710efc38e67cdf212594e8c483dac82cda14c3a07f61d5ac96df146f40a7de6
common_voice_mn_40420379.wav	Гэхдээ та хэрхэн мэдсэнээ хэлж өгнө үү.	c8dc8babf95a2ca4bc4b2bb462d1b8ddfeaf4500622618e4cc2138c6716114f1
common_voice_mn_18598996.wav	Ганцхан үгийн жишээгээр ийм байгаа болохоор бусад олон үгийн тухайд ойлгомжтой биз ээ.	9c405d07b4e347a71f4aa04ea56ffec9d5eefbb0d4be43b77f3cec08e227663a
common_voice_mn_40427065.wav	Ингээд одоо л нэг юм цагдаагийн мөрдөгчийн хорон явуулгыг ойлгожээ!	29b04b5861e6855382f536bfba0a8af489ac9e6d1017140e4dfd28725a59ba0f
common_voice_mn_18959835.wav	Дундаж давхаргынханд эергээр нөлөөлж чадвал миний зорилго биелж ашигтай байх болно.	b6e53ee8bedfe97dc38add65d536c3909179673a0465fa8251a1f9053da65e8b
common_voice_mn_40420311.wav	Шөнө нь нэг жигтэйхэн урт зүүд зүүдэллээ.	cbc18a4c83a150b42329d6f5fbcadb4a9a174c0c8be96b5217ab14c6e6ab8a5d
common_voice_mn_40328465.wav	Мэдээлэл хэт ачаалагдах үзэгдэл нь дэс дараатай, зөв хөгжүүлсэн хураангуйлуур амин чухал гэдгийг илтгэдэг.	c201ce99054a4b24f188523645914b7a509254cd0746e0ac1ff3e9af0e248217
common_voice_mn_40420321.wav	Өөрөө л мэдээд хөдөө хөхөрч, гадаа гандвал гандана л биз.	c24f4c6515d0bce58c2a4030278a19857e42638eda038956de9140baafa7d1bc
common_voice_mn_20420236.wav	Машинаа тавьчхаад одоохон яваад оръё, гял гялс гэж хэлээд л таг болчихлоо шүү.	3edbe7f6a7ad2c921b18185baa179a9af056fd73dc2468872372fe3869eaf005
common_voice_mn_20892687.wav	Тэгтэл нэг өдөр заан модыг нь шөргөөхөд үүртэй өндөг нь унаж бяцарч гэнээ.	aec5ad0e7e8c2342535fd38bfed9bddcaa64fdab6968bda0f50475e5c8372a50
common_voice_mn_18667727.wav	Гэвч яг үнэн учир нь үүнээс арай өөр байжээ.	a0630fc1f797747ee7a66a72f6dac5a1a08be6e25128d94b15d512c851fb4071
common_voice_mn_18634981.wav	Энэ бүх шинж тэмдэг илэрч та ацан шалаанд орсон мэт байдаг.	e8b3cb1c9b41094895f57eefe92eaff3b3d08123d258b67243a3162279d786b3
common_voice_mn_21814958.wav	Ёстой л далдыг хардаг увдистай байх.	bf97cd6563bd6e85a70039848e79b557b094d482a5765727c7862ac9928c4bf6
common_voice_mn_18577565.wav	Хөөрхий Туяа минь тал шиг сайхан сэтгэлтэй, даанч даруу бүсгүй шүү.	4a870904f2697d4ca75bb8832fb59fb7809503607475d57e5498507692c27c96
common_voice_mn_40588161.wav	Агуйд болгоомжтой орох, байгалийн ямар нэгэн сонин үзэгдэл тохиолдож болохыг Чулуун хүүхдүүдэд сануулав.	c4e44c4b129d8c19e781bf50cc2e7d8fe18117607a515f19251c70bcb8497058
common_voice_mn_40332918.wav	Дайн дэгдвэл төсөөлснөөс долоон доор юм болмоор санагдах юм.	c437830466d960a1edb934177b159297cb2fea23e6852fb5fab28013663fe784
common_voice_mn_31188974.wav	Ер нь ихэнх тохиолдолд ховор нандин зүйлийг олоход хэцүү байдаг жамтай.	01a2d453ee3cfa3a42df6405e0140c857024a8cc9547d7c7048a2744e79b0046
common_voice_mn_26189884.wav	Гэсэн ч залуу сэлмээ атгасаар байлаа.	005b0271957c025c909abc09c123d0c52e7eb69dc91557037983dd12bc5780c0
common_voice_mn_18577301.wav	Жаахан дөхөн очиход, өрөөсөн гараараа газар тулж, өндийхийг оролдон байгаа юм шиг харагдлаа.	2bd8ad85ad43b602a993bfde90c4fd97431907abdcd816166a74921a022f1a61
common_voice_mn_18601247.wav	Тэр үлгэр хэт их уншчихаад одоо сэрүүн зүүдэлж байна.	ddff5a810a24521f4f4122a2a61ddc4e2aead2152249c0d06ef7068c188f5e3e
common_voice_mn_21843458.wav	Тэр үдэш оронд орсон хойноо Туяагийн захидлыг арав дахин уншсан юм.	d99c151627ad30af5248f2586ad758f2dc00b220a09bcfcd724f72df6e371dd8
common_voice_mn_23409736.wav	Хагас сайн өдөр нийт хүүхдүүд халуун усанд орж ариун цэвэр сахиж байлаа.	7db5e1da4be20a77c26709a890158e2ab2abaa195ec7aa00b4a4fc6956f5ad26
common_voice_mn_40586647.wav	Хүний урманд толгой нь ч өвддөггүй хүүхэд.	aa168220758c3a9a1531cc928f7103ff3865f93165c2a4c1547e2d2145a0034b
common_voice_mn_40585784.wav	Энэ харлаад байгаа бол түймрийн нурам.	9a0af8e3ce2270458ffd55e757948acea4defbdb1a244c88e2f2e36d83f8f5d1
common_voice_mn_40468921.wav	"Тэр хэлц үгийн жинхэнэ эх нь ""хамгийн их ярьдаг хүмүүс хамгийн бага хийдэг"" гэдэг."	59fe39c696786fd3dfbd9ee00ed8f7a05fc7e41efc61363cf0d1138c1c503f35
common_voice_mn_40419688.wav	Чингэж хэдэн цаг сайхан ярилцан дотносож ярилцсаар явтал нэг мэдэхэд буух болчихсон байлаа.	c080e690d8b7f7524327c43b3c5455ecee3f6aabb726be403675947431590111
common_voice_mn_18577780.wav	Намайг хайж байгаа бол дохионы түүдэг асаана.	7ee864b9ec8696442fafec97b5d8e11a960219c335bfe6318e83bcfd824fd5b5
common_voice_mn_40583176.wav	Энэ бол саяын өвгөний дөчөөд жилийн өмнөх амьдралын нэгэн зураг байв.	f9d4b61a2a89d9d33c8aabca1dcbf30aa56d0ab912dfd0be158f2d33ce258aa1
common_voice_mn_20601788.wav	Таслан шийтгэх энэ хурал нь дээд лам нарын нэр хүндийг нэг мөсөн гутаав.	b9a34c568dd1ea3d8da3afa76c162b3d4d4e7716729a2e21fe8f2c2f9cf0c747
common_voice_mn_34919372.wav	Морь эцэж цуцсан болохоороо нэг хэсэг давхиад зогсов.	0f62a20668b0ed5877b797362813930a89cfaa6dfdc53ebafa3bbec1bf312aeb
common_voice_mn_18592954.wav	Хааны ордон тэдэнд үлгэрийн юм шиг сайхан байлаа.	a986b4c66c0b00b82e3ae0c8c048b717b81a614bb7331acbed1fe022771ff61c
common_voice_mn_19521491.wav	Гэхдээ, тэдэнтэй хамтран ажиллах ямар ч боломж гарсангүй.	6d9cefe89356f2cfb36557f0a7d374cd3c00c84f113792e845c5255c79daa094
common_voice_mn_18832236.wav	Дөрвөн зүг цэв цэлийн уйтгартай, цагаан униар тунана.	d7199d064a647d711eb57fd3f630e5ab253fa779738a41b72c3b068ca602c96e
common_voice_mn_18602500.wav	Яах гэж би үүнийг авч явдгаа өөрөө ч мэддэггүй юм.	fa94118195792423e84be44b04c938f50762226c33b0f2796e51a6ee69760353
common_voice_mn_18725001.wav	Би ээжээсээ уучлалт гуйж чадалгүй өнгөрсөн юм.	9816ea431bbc76b18e0f0a474bb6448e078807f8e95a8e0d05d197715e5e1a96
common_voice_mn_40548528.wav	Хэлний тухай олон тодорхойлолт байдаг ч хамгийн ерөнхийгөөр хэл бол хүний харилцааны хэрэглүүр юм.	417dfe209d097a87122cb0329a962168f4c7f862751dd58dfef5cc73bf28e744
common_voice_mn_40468988.wav	Одоо бодоход бас ч хашир оролдож, овоо овсгоо самбаа гаргасан шиг санагдана.	4d60ac566fb99d5c0c7e4d5808c9cbd1b15e890b9c0c48e336bc956886d27900
common_voice_mn_32929170.wav	Чи миний аль хэзээний мэдчихсэн зүйлээр намайг өвтгөж чадахгүй.	fd00a1051c6ba37067d376c1ee745d8288395961f17d1d6ece432e597f79f918
common_voice_mn_20883460.wav	Огт өвдөөгүй шүү дээ гэж тэр хачирхан гайхав.	a58d8f006697d1d6fc7c28b4e2c6bbabefa34a97bda5314c9ca2688cf770837d
common_voice_mn_40198348.wav	Өөрийг нь сэм сэмхэн ажиж явааг минь тэр гадарлаж байлаа.	991811f7a7fe4b8cb761425876197a5c09661be4e51be634e54aaae227b76037
common_voice_mn_18577652.wav	Би энд ямар хамаатай юм бэ?	33562ec35dc6f0e3caeee64897a0db9dce618d2ed59a285f245d572eff656a72
common_voice_mn_32068939.wav	Чи байтугай чамаас цаадах нь чадаагүй юмаа.	0f3bdbf6c2b817c8a5542e7b9fda5ef1ca90a67a69eaff25965dd5b8b02e9ec4
common_voice_mn_36413384.wav	Мөн багш, ажилчдыг коронавирусийн сургалтад хамруулна.	c2c2f9225a02e84e7aaab2db7a67804a2df009996bbf90be621fde7b0f192156
common_voice_mn_18960856.wav	Би ёстой амьдралдаа ч ингэж инээж үзсэнгүй гэжээ.	fe159f634b12865265cef7bf4ba3d2945e4a87fff1014fba70e83839f93c6213
common_voice_mn_18580720.wav	Айвал л хамаг хэрэг өнгөрөх нь тэр.	176d6373f67fc6fa1753635240de025c09208fef8035a41fbb7ef27fa859102b
common_voice_mn_29697173.wav	Бид чамайг яагаад энэ ажилд туслаач гэж гуйсныг мэдэж байна уу?	fa08dcc67e370c86ed6cdcf37362331d52d44157594147a4efd6ef39a550d878
common_voice_mn_28795622.wav	Том өрөөнд нэг их тавилга байхгүй, ердөө яг хэрэгтэй зүйл нь л байдаг байв.	f5cd78a373c2e9f822886a95ca384d51a1b653f821171a4ecdff336bc307b43f
common_voice_mn_21410799.wav	Алмаазан гадаргуутай болж ирмэг нь дугуйрснаараа асаах унтраах товчлуур гарт илүү эвтэйхэн болсон.	b49cbb6b8c502e5fd96eba25d3ebe4b668747c867b11b9f70fb6887ae662d0b6
common_voice_mn_20088397.wav	Жоржийн хийж чадсаныг та чадахгүй гэж үү?	6a8139aadc376054161fc9987fd2e7ea284006b6d95374fde36e8da79291bdca
common_voice_mn_21822959.wav	Би одоо болтол жаргалын үрийг суулгаагүй явсан.	e0321dd2b08c38cd0e33ed6832d84e1eabd20ae7aee4babbebea9a256d97886b
common_voice_mn_18674717.wav	Лам нарын дунд номлол унш гэж лам нарыг илгээж байна.	745a665dddd603fd6a73595806d0a907a88252f7d6614fc53d7ce660a407445c
common_voice_mn_18577736.wav	Тэд биднээс илүү алсыг харж байгаа.	4966496dc458fa779c9cccd5a734cb9ebcf9789c8ead1431c534cfeb74ce2ec8
common_voice_mn_18583685.wav	Ливерпүүл- ийн зураг кофены аяга, цамц, түлхүүрийн оосор, тэмдэглэлийн дэвтэр дээр нь хүртэл байна.	491ea45b5bdc39fb06aa9f78c1fa24413f96df23b50f3f7c0b0cc787c1dc34c9
common_voice_mn_18578226.wav	Гэхдээ би энд их алдартай ш дээ.	3c9d64ccfcfc8bce9045622b5670c07a3e553043f646fccd7bbef5c26caa9f2f
common_voice_mn_19807243.wav	Нойр нь хүрэв үү, эсвэл ямар нэг зүйл тунгаан бодохыг хүсэв үү, бүү мэд.	56d7040176d077b4cffe718edf97ca6850484d1bb3854ce8b4397aea10450731
common_voice_mn_18583947.wav	Одоо танд цүнхний талаар нарийн утга учир бүхий тайлбарыг толилуулъя.	78f99d2155e1d1d322fddc7ee8af95d9c69e0dea1fcab19e04610c16689cc1e4
common_voice_mn_18829289.wav	Уянгаа тэр хоёр аль болохоор хоорондоо тааралдахгүйг хичээнэ.	e96461c490ce593fd576c42d2a375aa72399b625bc3f235024d06be1fa24e158
common_voice_mn_40444495.wav	Би бүр тэр хурал дээр үг хэлэх гэсэн шүү.	91130be69e0f3a5fb25da10328e14969f143081a648a4c94de35b451a69dd62c
common_voice_mn_23409810.wav	Гэхдээ дайн дажингүй, цаг амгалан болбол гэж санаа алдан шивнэжээ.	95d053080efdfe827d9090f12ffe7e026610a47b6fb02b1e0b08c126bc9d1a1e
common_voice_mn_40546083.wav	Одоогийн нүүрсний нийлүүлэлтийн гинжин хэлхээг загварчлан үзүүлсэн нь төлөөлөгчдийн сонирхлыг татсан.	f4950f026abbe23590d1d09178d5d83192f16e42d92de0d85b4e3d573a8f3e32
common_voice_mn_18594956.wav	Нэгдүгээр ангид ороход сар илүү хожимдсон гэдгээс өөр юм хэлсэнгүй.	bb79029f3cbf3df467093921a7f6710d82c948ad3d73814b1f3cb29721eb4867
common_voice_mn_40587868.wav	Хөл нь урд өдрөөс илүү хавагнажээ.	c8560314dfe54397140d613836891d17d9d99a5412eefa8fa97b0560dfb96640
common_voice_mn_40198249.wav	Ийм чөлөөтэй сэлгэдэг байдал асуудлыг лавшруулахаас бус, шууд шийдэхгүй.	9bb4c1aa76ab3d0ec5f843a9d6ebf3c97ddf14a99bb79f121739801f52067eac
common_voice_mn_40503791.wav	Самбуу ч үнэхээр зоригтой, золбоотой аавын хүү юм гэж бахархах сэтгэл эрхгүй төрнө.	fa6b6979e86194745c1a81b1b2e9c5a4e98b5912669f1ec7a6e86f7c42f01888
common_voice_mn_18578308.wav	Тэгэхлээр баруун хөл дээрээ арай зөөлөн гишгэжээ.	3a8c2f6adcb2f8a146405f86a0f3aa30d178db9df90d03eab54bf92d3ab3e674
common_voice_mn_40350673.wav	Жанжин ноён та үүгээрээ юу хэлэх гээв?	dbd47657fe55c8a68d274f080ebc92ecf4e013b5ebc3716623b61b0ae53499bc
common_voice_mn_18725041.wav	Ийм байдал цөөнгүй тохиолддог юм.	53e0548ec25e0f9a249c42fe41d6f8769d548e0fe4e5a7d64e7f706db092b38e
common_voice_mn_37319149.wav	Тэр хоёр л уг нь энэ хэргийг үйлдчихсэн юм.	c3ac9c7f2d141e86c49b2c7909c2481322605476d7eba43e706676acf7bf19f6
common_voice_mn_25797339.wav	Тэр ч байтугай намайг асуудлыг маш хурдан шийдлээ хэмээн магтаж бахархаж байсан.	eb11e77a14413724ba9cf171b4bb4f16664ee7401eb25d9f433120dcc536d231
common_voice_mn_18583394.wav	Магадгүй Цэрэнпунцаг лам хаа нэгтээ амиа хорлосон байж ч мэднэ.	5b5427916fbcd04a207c7796dfc14e4d72a2cc9ff8648fe006be355e74881235
common_voice_mn_18694165.wav	Тэгээд өөр гоё тоглоом тоглож эхэллээ.	22e1cc3928ec754d9aa96f577bbb91856e60ac0348a57bb425e0c4320f2abe40
common_voice_mn_18598393.wav	Түүний сэтгэл санаа сайн байсан уу?	adcfce03dc4f934464f73457630bed9886a0c4b50369aa8d9734d94cbc7a138a
common_voice_mn_40419814.wav	Франклин зүйр цэцэн үгсийг жинхэнэ эхээр нь тэр чигт нь хуулбарлан хэрэглэдэггүй.	b290cdfe78e57720aea6afc86e37d8a45971122903e23ec930cfa3e9ea7d5783
common_voice_mn_18577917.wav	Үүнээс болоод их сургуульд ерөнхий боловсролын мэдлэг заах ч шаардлага гардаг.	4dd80a6bbf78322b78351f3ae4d0340de99027c28ee1345cdd3d32b2f6f9245d
common_voice_mn_18580572.wav	Ордонд маань олон дайчин харь омгоос ирцгээнэ.	48ef56731635afa7ade6fed0804347be063d6488fffa9a85a65e3579d2d40a96
common_voice_mn_21410814.wav	Гэхдээ өнөөгийн хүн амтай нь харьцуулж үзвэл тэд МАШ БАГА хувийг эзэлдэг.	d7c31d8fe18c1993f680a84fb0d49b2d9d80580067a1fe833d7108add95ab5b9
common_voice_mn_18610014.wav	"Өөрсдийнх нь сайрхдагаар ""ухаалаг үндэстэн"" дахиад нэг хол харайхад хүрэлцэхүйц ухаантай байж дөнгөх үү."	fd87a3b7b342c95dda4372c7ba3258bb460bdd18348cabbc5a9a9507c4cb4a4f
common_voice_mn_18725113.wav	Авиа чимээ чагнасаар би зогсоогоороо унтсан.	c8660daadfa2361081448327e9559bb9dc9df140da15d6d1c9eebeb4c3b36497
common_voice_mn_34599811.wav	Худалдан авалт бол ерөөсөө л тааламжтай сэтгэгдэл төрүүлэх явдал гэдгийг байгууллагууд мэдэрдэг болчхож.	0643156575e534f98e9e6ef0aff3f7d98c29b897058fb9e551a907e7e1d229c2
common_voice_mn_31437388.wav	Хожим Далай лам Ботала ордонд мөн хөхөө сард Гэлүгвагийн цамыг үүсгэн хөгжүүлжээ.	fcb17c3caa9532b6484d3cdd191687017e515c1a9ca5ed8d23c97c9b0e71ee05
common_voice_mn_40198002.wav	Гэхдээ ээжээсээ яав ийв гэж юу ч асуусангүй, ээж нь ч юм ярьсангүй.	95817a228bf3f659c935956a94a69ce9c35251421c63a669bdf7c843657f8567
common_voice_mn_18577707.wav	Чи энэ жаалыг хоёр алгадаж лонхтой сүүг нь хагалсан гэдэг үнэн үү?	79561b8ff3a45389e45158b02c1bd64363f29699c6949c9708142c9576d5f19d
common_voice_mn_40419831.wav	Тийм болохоор би ямар ч ажил байсан хамаагүй хийнэ.	b4683857471aa15947cecfcaa32dc711c79b5f783755b27363d6c85d0d55d8b3
common_voice_mn_24998467.wav	Бүх юманд тооцоотой нягт нямбай ханддаг нь түүний л зан.	dd1dd52f5388b02f1401d38d1d6acfb89a5d87d643db88f65fe9bbab582d0721
common_voice_mn_18578277.wav	- Харин ээ хө, бүр Сэлэнгэ орвол эндээс холгүй шүү дээ.	0a20abeccbdcaa37f242f10077c29edf3d117b3eb52cfedeca9e824f1ea71086
common_voice_mn_30060822.wav	Гурван зуун грамм спирт уулга гэв.	f6d59605982aa9e23a2e23c6660adf18eb1d5e460858c6801c827ee6a1d0a7b3
common_voice_mn_18930132.wav	Эд болбол, саяхан хэд хоногийн дотор гараад ойр хавийн хүн малыг сүйтгэн байна.	f3d09a6aa488bb64746396d3daa67ff1f5c1cb6be77be320a09cdb5145ff47f0
common_voice_mn_18578484.wav	Ингээд тэр туранхай саарал үрээг авч манайхаар дайраад гарч явсан хэрэг.	2819663058a5a90ac456ebdee79ee7890e23afc6786e6f999e5bab431481d87f
common_voice_mn_18829294.wav	Хувьсгалын үйл хэрэг аюулд орлоо гэнэ.	f431da617b0b2f4ead17053a23ecc95378d0137aa9cbbf5f3414a0cd9e29304b
common_voice_mn_18578293.wav	Бид хоёр албан ёсоор танилцаагүй л дээ гэж Мэри хариулав.	260c9a6daf8542415a3252de720d9b923fa7538942e415eccb12e6fb547661db
common_voice_mn_20990705.wav	Эзний эхнэр надад бөөрөнхий дээрээ улам бөөрөнхий болно гээд сүү өгдөггүй биз.	bc2c38a0c94af7728777ca98e546f4e8dbb8928aea137dd13989c72156a03793
common_voice_mn_20890044.wav	Дараа нь үр хөврөл амилчих байх гэж бодсон чинь үр хөврөлүүд амилсангүй.	6692e59cf0ba7d8e02286b6b513b308625a8b8da1c7b0209d7490edaeb35053e
common_voice_mn_20119935.wav	Үхэж буй залуу усанд живж буй хүн шиг бөглүү дуугарлаа.	255184f02a71185be5357aadae49e2e0aa238da975f456b4d305545c00ca8890
common_voice_mn_18630492.wav	Хичээл бүрийн агуулгаас хэрэглэх арга шалтгаалдаг тухай бичжээ.	f10b566f09b616fd957a886aa4b4f587fbb4c0ae89682afbcdb2e16c76c1200a
common_voice_mn_20889964.wav	"Оюун билгийг захирагч Манзушир бурхныг ""амарлингуй зөөлөн дүрт, нэг нигуурт, хоёрт мутарт"" хэмээн дүрсэлдэг."	9b46b484d4cc3e9b4d1f9ef49a5d664168f0e4d3b76f30a41b4f82eff690fb1e
common_voice_mn_18577981.wav	Энэ шугамыг давбал юу болох бол?	40185f27202f2b8fb28b3fda4791c3b2b0d5c9749e1ea67b575f66c63d34c1c9
common_voice_mn_18587227.wav	Бэлэн мөнгөгүй бол бараа солилцооны саналуудыг ч нухацтай судалж үзэхэд илүүдэхгүй.	8dae045d3b2f5813c01cbf8126e8400c8bb56c89caa2c796d8b1a1359ad52235
common_voice_mn_23409813.wav	Жан овогт сүхээр цохиулсан мэт ханзан дээр яг хийтэл суув.	9649b7f0ce4416c97b2616a3dfe3fdae3eefc7298eff70fe870ff5d7a4258668
common_voice_mn_18577650.wav	Би охины чинь өшөөг авмаар байна!	2e9e15d8f8a6d4e27ba4357f474173b37399d6be21310f4c908d3001cc2b7d86
common_voice_mn_18580844.wav	Эрт урьдын цагт нэгэн ажилчин шоргоолж уулын бэлд амь зуун, өдөр хоногийг өнгөрөөдөг байжээ.	8e64b190347232b16c71fe6aec0f5f5b1728475c4e4e8c2a4994c9cd4470799a
common_voice_mn_19523684.wav	Тийм амар түүний гараас салахгүй дээ.	649a49540f90a958df97c9a467a982940d1c3a68b3e9e6e7abff03f83ca677d5
common_voice_mn_18696549.wav	Балдан нэг өдөр сумынхаа төв дээр очиж, сүүлчийн сонин сэтгүүлүүдийг аваад харихаар давхиж явав.	ad9282eb3d96e1fecfdd26f8835e9fa648bd94e7e0475c3f8c060a94589091b2
common_voice_mn_18577749.wav	Тийм ээ гэж ноён Каннингем өгүүлэв.	6ff05bfe7edec3c4d5a9ee375dab9662761a62b8bfcadf1d09e720cba6348f5c
common_voice_mn_40424872.wav	Охид чарлаад л бүгд ухаан жолоогүй гүйцгээлээ.	f9121152f646f760678d9d217cf5030942f666ce8a974403ca6f0937301f23a3
common_voice_mn_18586710.wav	Тэрбээр хөгжим сонсохдоо ч Бурханы сургаалаас сэтгэлийн цэнгэл эрэх хэрэгтэй.	98235732fc5c5cfddf0c2bd172be2d62a14f97d8c6e9dd79d8ea0dc9925b6b24
common_voice_mn_40391615.wav	Хотондоо ороогүй хоньд хашаа тойрон сул эргэлдэж зарим нь белоруссын дугуй шөргөөн үнэрлэх ажээ.	fb290a9e4337a5b38ca7238bcd13c743a62e58cfb9b939a268539018e404d541
common_voice_mn_21665514.wav	Орос дизайнерууд зуслангийн байшингийн хана нь моддыг санагдуулам бор, шаргал өнгөтэй байхыг зөвлөж байна.	cfa23dba27deea7cdf522233c9bc5e60a15ecae1ea43d173f6fcc9337a579aa2
common_voice_mn_23409858.wav	Харин тэд бол гэрийнхээ босгыг даваад монголоор ярьж амьдрах арга мухардах байдалд ордог юм.	7ee3add72faf3cca3438a86dba8b1bf0f570b460767d2211e94da6521e15a97a
common_voice_mn_18586830.wav	Хонх гэснээс Хөхөвгөн гуай ачийгаа бодвол дуу цөөтэй хүн.	8bfc1676dfa8f2f257a8c33b545fd6bb065088f3b592bec13797cd01c4261532
