path	sentence	sentence_id
common_voice_mn_23409678.wav	Гэхдээ Дээд Монголчуудын шашингүй болох үндсийг зөвхөн коммунизм, марксизмтай холбон үзэж бас болохгүй юм.	67038f08448c7a8397d1a5825c8e415e9a16d7f316941972f324ed74edf5b090
common_voice_mn_19002352.wav	Дараа ирж уулзаарай гэвэл үг дуугүй толгой дохиж бөгтийн алхана.	2fe386c2c823a100b0a2e30469af9f7020c72758bfed9a3f7a0246be0966db53
common_voice_mn_18963242.wav	Чамтай заваарч суух цаг бидэнд алга.	09bcab3f1ad52ecba7e0fbf95ff112344713a3561d0a1b511b02b123467ffdd1
common_voice_mn_40440249.wav	Би тэр өдөрт нь хариу бичиж хоёр жижиг номын хамт явуулав.	b376fded95ae7b759d6991941f046fac13178507ca8ce8f7bca0a36e626f9afa
common_voice_mn_20990703.wav	Хамгийн гол нь бүх юм бүтээсэй!	a5dc67bd164079f4bc4cbefb04e16303c5bee53e376e0c7612ccaac487f31b7b
common_voice_mn_40433923.wav	Гэвч тэр өчигдөр хэн байв гэдгийг би мэдэхийг хүсэж байна.	76fc771b0bc491859f14834dcaf065142d3e50c9ea2465ded45d39d71c2d2181
common_voice_mn_32069077.wav	Орохын хонх жингэнэн дуугарахад завсарлагаагаар шуугилдаж байсан хүүхдүүд анги ангидаа суудлаа эзлэв.	f2c89f888ecb7d291b798c48bb950f0fa69c25e2303b6151c0fec827ef79048b
common_voice_mn_19027859.wav	Чи одоо хаана амьдарч байна вэ?	5aae785c0b436e5df76f888e05e2966fc2c779e4d075b4e32cce232415344568
common_voice_mn_18605389.wav	Тэд шинэ улс байгуулагдсанаас хойш хятад уламжлалаас нэвтрүүлсэн тогтолцооны дагуу найман зэргээр ялгарсан.	de9dbc660ea39801361d9bcb8696402da7a0f0382408acd70110d5722fb6e187
common_voice_mn_18583440.wav	Би чамд ердөө гурав хоногийн хугацаа өгье.	74e281508bafdf41a13443585fe54540df1055d0a02f1fad5d6837b89ae4a283
common_voice_mn_18725135.wav	Залуучууд хүүхдүүд маань хашир малчдыг дагаад сайн ажиллаж байгаа.	7f5580d800f2c01f9fc73cdfe173c72cc4d39b7eefb7e2682b3bce0edffdbf8f
common_voice_mn_18959833.wav	Тавантолгойн ордыг эзэмших тогтоолын төслийг дурдан, анхаарлыг өөр тийш чиглүүлэх хэрэггүй.	fe2d855ac1e7ffddeb36540bfc59034c4a51eaf713890fabc7a506b663589854
common_voice_mn_20861605.wav	Зургаан цагаас эндхийн биш найзтай аятайхан дуутай бүсгүй хүрч ирнэ.	bee5a50a0162c9e7eeabdbade98407df5a59bfe4f6ef49b93677d9c2e85ba2bd
common_voice_mn_40550823.wav	Дараагийнх нь хэн бэ гэдэгт тэр эргэлзсэнгүй.	6e45681e95ccb6a3e0bcf78d913880ac25dbf7c5d0724893fa62de4020671387
common_voice_mn_18578303.wav	Та хэзээ нэгтэй өөрийгөө туйлдуулж үзсэн үү?	54893b07379bb2085cefff5f5193a65569d6528fd5e5c1576e9fe285263b72e9
common_voice_mn_19002361.wav	Амьдралын мөр хөөсөн нээрээ ч бурханд сүсэгтэй ядуу хүмүүс бий.	f48e6ebd4aab413585285735979a6a146524aaba7ec1eb0d0db198a6a9111c27
common_voice_mn_32136512.wav	Тэр өглөөний гурван цаг хүртэл ажиллаж, хоногтоо дөрөвхөн цаг унтчихаад хичээлдээ явдаг байжээ.	0991001308a988f1af7bc14f5f860683e8221e4e2f591b9fa8373c375cb50c64
common_voice_mn_40555616.wav	Гэвч нэгдлийн захиргаа зориуд томилон явуулсан байжээ.	8a5b0b7fcb6a87828d6e3d87fdf3c8a19794077c8e69c0b9f370f90ed443e554
common_voice_mn_19002316.wav	Юуны тулд гэрлэлтийн амьдрал нь хоорондын зохицлын шинжтэй сэтгэлтэй байх болзол шаардагдах ёстой.	2e53bee44fdd46f3026335e0e6dc11938a9555ba23c01cd029f09591e165fe84
common_voice_mn_20541288.wav	Гэвч энэ шинэ хотхон түүнийг юугаар ч гомдоогоогүйг хэлбэл зохино.	5ac350e646aebb94c6684ec52a4f01a57908751684e35e570cf82f213e052656
common_voice_mn_18580492.wav	Үнэнээ хэлсэн чинь дээр байх шүү.	6200c8c884b54bac2bd98acfdeee6a52f4f20ef4e6aa13ec8514178181eaadcd
common_voice_mn_38401393.wav	Тэр өөрөө ч чухал хүн болгон харагдуулахыг хүсэхгүй байв.	4fe2afe682c418501ecf85847e2d95c674191083673e42af3334526c3f810c85
common_voice_mn_40546398.wav	Мэдэхгүй зүйл тохиолдлоо гээд гутрах хэрэггүй.	eb039d1b6d6cc70186e2b1a8ed0a7cb5f4a378362f59963fafef29d5e91f11c2
common_voice_mn_18608392.wav	Тэр газар дор байдаг харанхуй нүхэнд нь дагаж очих болов.	edcd07c8980a29c614107a059c0a3fc3f35dcfd68f30b61dfa695ac97e3a2cef
common_voice_mn_20883459.wav	Жүүдийн эсрэг арабуудын экстремизм нь нацизмын үзэл суртлаар тэжээгддэг.	b90b1d64f0fb7f19692b88938f0aab386ac3bcfde4bc6637b4d10306820d2e3b
common_voice_mn_18578233.wav	Тэрээр өөрийнхийгөө хурдхан сурчхаад найзуудынхаа хичээлд тусалдаг байв.	53f40853eaa79310151b7eabc6ee4867f3d5a438d30de9d4519cdac5d972e107
common_voice_mn_30704902.wav	Сониноос нөгөө залуу чинь яасан бэ?	cd6f9f219cd2e26d6680c1f025808505ac15922d4efd24bf2dc16224da33b36c
common_voice_mn_40169304.wav	Эвлэн зохицохын эхлэл нь тэнцвэр байдаг.	2d0a980cef5b2e1b1641659e64617fb1223ea978406681dc49fdb04495efd1ec
common_voice_mn_23551701.wav	Маш энгийн боловч сонирхолтой энэ туршилтыг анх Вебер хийж байжээ.	e19a4a8ef470270c10b758dc59208b3f247bad1e6191c04b182ae7b2a3dc9e73
common_voice_mn_18586832.wav	Амьдралд алдаж болохгүй агшин гэж тохиодог.	8f5555569390edb5084371af54b5f019ca8777be7193f1c248af81aabc4dc787
common_voice_mn_21823073.wav	Нэг өдөр нөхөр маань тариа бригад орохоор ачааны машин дээр суугаад явлаа.	dba7b2f55d4751c1c7dac32831f3c8ac3ff9c11089c2839bdeb50ed8638fcd59
common_voice_mn_40472306.wav	Эрх баригчдаас бус, эмнэлгийнхээ удирдах зөвлөлөөс зөвшөөрөл авах нь л доктор Вүд хангалттай байжээ.	71f4f02fc88e84c721384cbb5e600aa4000b56ef5606955d1c9b267d52eae869
common_voice_mn_18963261.wav	Байгууллага дахь харилцааг албан ба албан бус гэж ангилдаг.	22e1168e59097e044a6979f468e1ecac3e671218d356cceab81a17b7b27ab483
common_voice_mn_18577963.wav	Засгийн газар бас байдгаараа хичээвч түүний бүх зүтгэл үр дүнгүй болж байлаа.	068cfaba76fcf92de25ea16d742edbfcea538193915cb7050e9bac01137b96bc
common_voice_mn_19002309.wav	Төмөр гарт түүний өрсөлдөгч биш гэдгээ мэдэж хүлцэнгүй байдалтай ухрав.	28084f140b63c3d34e50ab0d64607af444010fb3a8771ed4bb05dccdd8eab848
common_voice_mn_18578261.wav	Энэ цохилт тун муугүй үр дүнд хүрсэн нь харагдана.	4254269feccabb333bf6db24ca1dcebe637787557eabb3edb8ed9421e3582384
common_voice_mn_40445470.wav	Огт сураггүй байтал нэг өдөр найз чинь ирж, чиний тухай ярьсан.	c592e87a1c560d2fc51f01ae5ed234b567d29f2ff9326203537049a5c9d036e7
common_voice_mn_20601864.wav	Гэхдээ удахгүй зүгээр болчихно.	ab7e485b1b63302fea446b7d56691a196099e55b7d9da71208125d1f92c10caf
common_voice_mn_31437309.wav	Гэвч тэдэнд таарах ямар ч түлхүүр бидэнд байхгүй.	07d26ff05dfc76313240ba71fd0d843d13a0c0254949a74ab5be3088227b05b7
common_voice_mn_18591181.wav	Би таны хөлийн дэргэд ингэж суухыг эртнээс мөрөөдөв гэж гүн алга хавсран хэллээ.	b4166dd44aa9b4cc688fd291523b3eeb68aa002e1ad8f2ac568296d6fad18133
common_voice_mn_18580333.wav	Ааш сайтай айлд амьтан бүр цугладаг, амт сайтай идээнд хүн бүхэн цугладаг.	07f76156cfb7af174885b13e295e250886f2168463df37f145d426f1ca3cf128
common_voice_mn_28795934.wav	Бид хоёр сэтгэл ихэд хангалуун гарч ирээд шатны эхэнд хэсэг зогсознолоо.	004955390ac3752f3ad671521b6b650d6f2b4924bacfaa3fa587bb0ad43ed955
common_voice_mn_18603967.wav	Судас тэлж цус хураахдаа гэмгүй болно.	ea49c4fddb527d84bd4810c9265675cec563f548443f36084602ad094d277186
common_voice_mn_38401389.wav	Бид цөмөөрөө л хөнгөн нимгэн хувцастай суудаг байхад Лувсан ганцаараа нэхий дээлтэй суудаг сан.	51616354754b7e0dd6a53883bf13cebfae8fec4db18e3c6ea4a88b6b432c7a09
common_voice_mn_19000000.wav	Чи миний ээжтэй юу тохиолдсоныг мэдэх ёстой.	37f8a61138686cd8363d8100a492dcf30adaf94d7d133097cdf6e176092d555d
common_voice_mn_18580109.wav	Ямар байдлаас юунд дэвшин хүрэх ёстой вэ?	92bbfcd020ef1833167845cdadaee04831ce7ccc3e8444e7f894a834f03a39ff
common_voice_mn_40420327.wav	Надаас гуйгаа ч үгүй л дээ.	d58b44a2b57f384c56e26e8c31468673f4f758d508e50dd1fe4a30d2eb57da81
common_voice_mn_36413377.wav	Цусаа өгөөд байвал бие муудна, цусны хэмжээ багасна гэх зэрэг буруу бодолтой байдгаа илэрхийлжээ.	109e5dbbbb6f7e58d50b85f88340620071bd68344b84513c5dfa8c6a77d4b99f
common_voice_mn_32142299.wav	Адуу дэллэж үхрийн савга сүүл хяргах ч гайгүй хэрэг.	f4dccdc7e65fd2d0d15d4dbbda06960a426f7f61de628a6f347c3828f37178cf
common_voice_mn_37772502.wav	Энэ ажиллагаа бол нууц ажиллагаа гэдгийг бүгд ойлгох хэрэгтэй.	1c055fdc8c26a27093801ed46e0188cb82e7a50d388d2cbdc31c266e4647d77a
common_voice_mn_18584024.wav	Яг энэ үед хүчтэй бороо орж эхэллээ.	3c7633b37dae4e4996ad0b90ab8e03877c41c03f65e3389f7a52b001bbdb01b9
common_voice_mn_18578079.wav	Гэвч түүний үгний зарим нэг нь Скарлеттад ухаалаг санагджээ.	219f74dac783cd008bdf5cc13d7864c23840c3d1b5a88648b10c33ca1ad605d4
common_voice_mn_18587965.wav	Өнгөрсөн зуунд бид Ойн нууранд бүгдийг ялсан.	9cf1e84266cf90eec1a505a3847196563cdc25413863ef544bf49df0013b578a
common_voice_mn_18586699.wav	Хошигнол гэдэг нь маш мэдрэмжтэй ашиглах зэвсэг юм.	9995ea43fd60c85bbbd34d85fd14c1e79419dec4f71dbe79dba700b89b6e227a
common_voice_mn_40197807.wav	Аливаа түүх амьдрал тэмцэл ба үхлийн зорилго юу юм бэ?	96ca5ec25d4376b6e30b5f025b088a3207232ddc879d97dbceb958e082ffbd97
common_voice_mn_18597805.wav	Тэгвэл алзахгүйгээр мөнгөтэй болох аргыг олж сурах болно.	98c91d0a7e30911d474db3c0c3e31f3f42ef492ce71b36fbcea5a0bc63d65178
common_voice_mn_18656044.wav	Энэ удаа ч гэсэн өөрийг нь сэрхийлгэхээр юм хэлнэ гэж огт бодсонгүй.	f5074747fd8fefb07435bb3008b2a60dc813c6d686473839cf5d34f40b576846
common_voice_mn_20087877.wav	Нар нэлээд дээр хөөрч халуун шатавч өвгөн дурандсаар суулаа.	575fe2a4f6d96728b12f5e3a1953f0c41f8528f4bfb15058f8c49918646aae24
common_voice_mn_18586351.wav	Хэн тэгж хэлж байгаа юм?	77df5549d4af4840611568d44b0fc5a658cfe6223bf1e312ea8e64367b8d52dc
common_voice_mn_40547917.wav	Санал хүсэлтийн утсыг олон газар ажиллуулдаг ч, залгаад улам уурлаад дуусах нь элбэг тохиолддог.	f4b4cd85b9c1384285c7b47f9436829216b929fdc3295682f11b7fd6a702e331
common_voice_mn_23409455.wav	Түүний бизнес болоод туршлагын талаарх лекцийг текстээр болон видео хэлбэрээр үзэх боломжтой.	b0c10ad682f2f08d54a6c8b15d2936a42c523375f137e5badf73e28376373d70
common_voice_mn_40593676.wav	Өөрөөр хэлбэл, Сэцэн хүндлэн хан цол булган сүүлтэй байсан гэж хэлж болно.	5659ef73fcb8797a115e3a228c97824de0788a69cd25b4cd50d73faa0ee85431
common_voice_mn_18960833.wav	Аль вэ та нааш нь өг.	1578097fc5a572d211b8251958c60576e94085598dd4e7c2fcadcaf1f531d03b
common_voice_mn_21814899.wav	Жишээлбэл, энгийн тариачин гаралтай Лю Бангийн байгуулсан Хань улс чухам энд түшиглэж зөвтгөгдсөн гэдэг.	db88db52d2f75d3a21875ae46845322bfa921eed16e99754e9edc3d089e416ac
common_voice_mn_40434453.wav	Ардчилсан тогтолцоонд шилжсэнээс хойш өсөж, төрж хүмүүжсэн шинэ үеийнхэн гэж болно.	60c95bcb1aa58321877054dab5adeaeb2671a3dcbd91f7c536f47cd342a834c0
common_voice_mn_18934494.wav	Хэрэв би цагдаа нарт найдсан бол та нарт хандахгүй байхсан гэж бизнесмен бувтнав.	9e8db6a6bd99461a01d7576944ebe3108daa749a20367f62fc26e35011c741d0
common_voice_mn_19565751.wav	Япон ламын эхнэр гэхээр нь би санав.	5506844de160752ecf24ccc0360aa8029100ebaa9f9f9f6753927f38234464fd
common_voice_mn_18577412.wav	Хэдхэн минут алхаад би Арслантай гүүр өөд өгсөж явлаа.	32ba5f9224fd2b3c27c46a800f5618d5a20aae547ffcfbfbf86cb920316f4f9d
common_voice_mn_40472073.wav	Хамгийн чухал гэсэн таван сэдвийг сонгоод, түүндээ тулгуурлан таван дуугаа хийсэн.	8be0c4147b6af8f65e8d9519604e9abc3b51a869f15bae99bba9ac91174d602e
common_voice_mn_19002325.wav	Итгэмээргүй бүх юм сайхан сонсогдож байна.	9cfaff1970cf06bc2e94ae5a0f2216bd0ef32bae8c36bdc16259c072e92160fa
common_voice_mn_19020717.wav	Гэвч хоёр хэсэг тасран, хүний толгой шовсхийсэн манхан руу таран давшив.	e1d66f0dd33292f1e943703ba5c0e5e4f1ad65bb37c80ce7b9d19ce7d92a514c
common_voice_mn_18608393.wav	Мөрдөн байцаагч хэргийн газар шуурхай групптэй очжээ.	0e3ac808e29e97845d24d6d3ad7c4b1c56950ad5be854f179f887acdcae7fbb6
common_voice_mn_18655999.wav	Тэдний ойролцоо амьдардаг тосгоны зарим хүүхдүүдэд польшоор уншиж бичихийг зааж эхлэв.	201f22de6a79d6dd1ce70ab7e3936513934570170eeb8f779f9fd24d861319f6
common_voice_mn_18603539.wav	Харуул ч бас нууц үгийг авчээ.	b0a26906ace9cfc74855e369edc0ecfb97e4537f5e0bbef2dd51b9bd6e966310
common_voice_mn_32929140.wav	Мөн тусгай итгэж эрхлүүлсэн хүнгүй ажээ.	f491e7c538c133f929e5e7ad7c006c6642056cda18b7b4ef694d23ea77ef3de3
common_voice_mn_40434742.wav	Хэрэг дээрээ Сингапурын технократ засаг энэ бүхнийг хэдийн ухамсарлаж бодлого, практик хоёртоо засвар оруулсан.	892921dbf94c797e3e2ceae204bda854a5c06edf27cc43aa7efc0a01fca0bdd3
common_voice_mn_40426978.wav	Энэ чинь харин шилдэг санаа байна.	fbef50b30455c0cc56443daa3007905cbc2a83ef87f4e616e4fba79ce99fc3a3
common_voice_mn_18605918.wav	Хэрвээ өдөр тутам сэтгэлээ шинжилбэл дандаа л нэг юм дутуу байдаг.	01524c04b1e47dbcd27c8828c8a58b75f83e188495e7ad24f99a19fade08dc8a
common_voice_mn_18758747.wav	Хөрс шороотой л газар бол амьдарч байх хугацаандаа мод суулгаарай.	887803571758882170da0ee08cf1db091f0dcbe3c6ca33eda3139f67a87bf9fc
common_voice_mn_18577351.wav	Ой мод шингэрч байгааг мэдэж байна уу?	1d0a860f7dfdd2a9e8130392d4a1660d85baaab875a11183f280ed1b7e8d5432
common_voice_mn_18654753.wav	Ийм ажилсаг, хар бор ажилд чаданги бүсгүй орчин үед ховор шүү.	108a04b0adf02b72c1983243f0b9e7da05f710e6d3287df8d836612912071f3e
common_voice_mn_20541760.wav	Сүм хийдүүдийн үйл ажиллагаандаа зарцуулах хөрөнгө мөнгөний нөөцийг бүрдүүлэх боломжийг хуулиар зөвшөөрсөн байдаг.	864bad47e99808da4f28db7ff44de85ac7632cf2538878cc56282267d266564c
common_voice_mn_40434663.wav	Тэгтэл юунаас болсныг мэдэхгүй нүдэнд нь нулимс хурсан билээ.	751b92bddadf8be6f3ea589150cec40c79373821252e6cecee813fcfca4febf3
common_voice_mn_19670538.wav	Нээрээ түүнийг хилийн боомтоор гаргаж дийлэхгүй.	6d7dd1c621cfcfc46103d4be6a39c7af65ca2a0597c60ba52a7bd23094f9c117
common_voice_mn_18725065.wav	Гутрахдаа хамт ажил хийдэг хүмүүстэйгээ нийлж архи уудаг болжээ.	c42830129328fc5cfc0f5f5b6256dfbc1c26ef97e2b514308f7a4c7969539789
common_voice_mn_40574082.wav	Ховын үгэнд хол ойр гэж үгүй, хорт могойд бүдүүн нарийн гэж үгүй.	a8062dc9438b97a16b37a2a8f2b995add035e3b4605a885b098ac5689c68bc0e
common_voice_mn_40431344.wav	Ажиллах температуртаа хүрэх хөдөлгүүрт сайн байдаг бол эзэн харин шууд л давхиад явчихмаар байдаг.	59e005785199221cad943e4d3b8fbab2257cc7f77c3f365f5ac328cdcbd19d7f
common_voice_mn_40447083.wav	Хүн зөвхөн тодорхойгүй бүрхэг зүйлсээс л айдаг.	a77724d21ebaeddf27e6ccb0632eac435b3b4137646025fd8fdcb8cd831efbc6
common_voice_mn_18584084.wav	Энэ золгүй явдалд та буруугүй шүү дээ.	7dbc336c12790910b78f4b94eac2468add9deeadf867b70eaa781de1d4713076
common_voice_mn_20452247.wav	Гэхдээ энэ тоог өдрөөр биш сараар тооцдог тул харилцан адилгүй байдаг гэнэ.	73507dc0447ae552ef02116dce1cc524584245a724054070469281e4160eac42
common_voice_mn_40462396.wav	Тийм учраас охид нь, Ирене Эве хоёр ээжийгээ төлөөлөн оролцож байлаа.	9b1050b662b19267c8f15f43d3fb9e9f524338a771113b34f4817a2deb4063ae
common_voice_mn_18577225.wav	Энэ үеэр олон улсад хүлээн зөвшөөрөгдсөн шийдлийг боловсруулахын чухлыг онцолж байлаа.	2c8a58ad2dc6a9148fd3610f1b94c4dddc9bc69e62e00878660819e67cedb205
common_voice_mn_18766096.wav	Байгалийн тухай хусан дээр ургасан хушны тухай л бодож.	d006d7831d7505be6d8813a172afaea812a0203cdfa754e07ca170d0991e55b3
common_voice_mn_40555435.wav	Амьдрал дахь хамгийн их зөрөлдөөн бол хүмүүс төрөл бүрийн дүрмээр тоглодгийн ул мөр.	9b908e037f4b868d9efb57e033b82140ac3f92969ff2aadf13640780578a3e41
common_voice_mn_40583535.wav	Хэрэв капиталистад мөнгө хэрэгтэй болбол тэр улам шаргуу ажиллана.	0ce84cddc9fc62ab6d994ed0d2c335714cbd059f2c3af91a2d50f614e1f27346
common_voice_mn_23409571.wav	Майхнаас гурван залуу гарч ирээд яаж мэндлэх ч учраа олохгүй сандрахдаа бие биеэ нударцгаав.	92f03a48330f063ea55ab62dcfc1d131247611fd5ca6f245dd82e3c56ec9e541
common_voice_mn_18988936.wav	Самдан улам ч ов асаж Цэрэгмаагийн бүсэлхийгээр тэврэхэд гарыг нь түлхэн зайлуулав.	324f32874d9084e527c1bd7ec71ee3f4dd0121653744bae7284171fdbe9cb3f8
common_voice_mn_18591179.wav	Харин түүний утасны дуудлагын заримд нь л хариулахгүй байж болно.	b347a3b652d538ad9796d5d0d08d89722e92e3bfb1cfee1f687b60aedff52b5e
common_voice_mn_18960845.wav	Унгарчууд хүний тоогоор давуу болсноороо хамгаалахад илүү хялбар болсноос гадна довтолгоо ч хурдаслаа.	9080372f61587323801d7cd2ed1bcea8aa5314d5b90979080cd0fd49124296eb
common_voice_mn_40426574.wav	Өсвөр насны хүүхэд яагаад өмнөө ахадсан зорилт тавих ёстой гэж бичсэнээ тайлбарлая.	f1fb73f9778b5e290cedd0f3f6f8d82f367019b70f8733ce836d8b41f2435b26
common_voice_mn_26210605.wav	Тэд Ховардын гэрээс кокаин, мет, героин гэх мэт бүх төрлийн хар тамхийг олжээ.	006c48970a920a8190996a25e9d3162578b964e1b13bfe57b335e6975b40567b
common_voice_mn_18580128.wav	Энэ үед бөөн дуу чимээнээс болж нойрноосоо сэрсэн Тулгаа тэдний хажууд хүрч ирлээ.	b21e72bb64bc8f21399e042483d4193004f50a19b0d35fc7f35e97bbdc110e9d
common_voice_mn_20675284.wav	Азгүй нь, аль ч сургуулийн элсэлтийн хуваарьт миний нэр байсангүй.	ab3b83e09eef2e17220dc2ed0ed9f15f0b060e86ca9006d0504119fe6caf2227
common_voice_mn_18789224.wav	Заримдаа над цээрээс харуулдсан модны зомгол ирж авдаг юм.	9f6e7c0e914a8a7440b53c10584318734a1e308bc185b2547790ce35691b4773
common_voice_mn_23835649.wav	Харин сүсгээ ухамсарлаж байгаа арга нь өөр өөр гэх үү дээ.	97b0740d1871918d542e320f5c20a9393677840c37596ce6053fc50d27b6562f
common_voice_mn_18588834.wav	Амандаа орсон өөхийг хэлээрээ түлхээд хаячихлаа.	8a54a634003fc3b2efa8e38d1d5d3f83c2f7d16ad94fd173822272de380a5feb
common_voice_mn_18750295.wav	Дэг журам гэдэг чинь дандаа мөхөл дагуулж байдаг юм.	58c79746f575e746c2a5f8af70b4bcc4602ba42fa5de0c40956e705f85cd36f5
common_voice_mn_28804327.wav	Багийн бүрэлдэхүүн бол уг нь сайн боловч дасгалжуулагчийн арга барил буруудсан байж болох.	fce2f56043d653de7b925af0cd1285fc1366272ef063038ea0a08f0c85f5f8c1
common_voice_mn_18960922.wav	Гэвч Холбооныхон болоод тэдний гэр бүл үлдэж одоо өлсөж байна.	035ac9486f1dcac37fb929c0f4e6c2c5fdbe1d9cbf5fcee275019c0f6c8dfd2d
common_voice_mn_19002357.wav	Гэрэлт орчлон гэдэг эх минь байв.	884eb9723f57c4fba5f1c0e3606a02c93bd048db219841c24113af0a4e61cfa9
common_voice_mn_18960969.wav	Аймгийн Намын хороонд Горькийн сургуульд явъя гээд өргөдөл өгсөн чинь зөвшөөрөөгүй.	6d167953128994c2a2d86eeca310e20aa1ef600bcabae73cbe5d12fb2d49b3ae
common_voice_mn_40420297.wav	Зураг, бичвэр хослуулан үйл явдлыг хүүрнэж буй цаасан дээрх хэлбэрийг комикс гэнэ.	957424bbfb276764afee412b87dc8fc5bd974a56b9b861bf8997cb01a521d04e
common_voice_mn_40430441.wav	Тэгтэл ийм шийтгэл зөвхөн манайханд байдаг биш сургуульд бас байдгийг үзээд гайхаж гүйцэв.	154459dc46a7aded6583b73ec591d89c4f0063d0d04a57caa25eb62f8f376f1c
common_voice_mn_40534998.wav	Тиймдээ ч ухаантайгаа өөд нар харуулдаггүй байх.	cc92829caadc952fb6e0da2e9db8090a40f3962b02e70e99185686db2170489c
common_voice_mn_40440153.wav	Битгий уйл даа хонгорхон охин минь.	a25e6d54b25462ce3d81d85e913935de0671aee647be3d9feb4ad7ea77afe34f
common_voice_mn_19521609.wav	Орныхоо дээд талд хүрэн гудас дэвсээд үд болтол үхсэн мэт нам унтжээ.	6e67800e6002cefcd46fb9910a562ffdfec0adafac31c4d147d0b398ce092692
common_voice_mn_18725519.wav	Би Тэрэлжийн амралтад арван тав хоног амраад, яг ажилд орохынхоо урьд өдөр онгоцоор харив.	d96554d6ad00bdb9c0b05f9b2800d94be634cf1b94299cb96ce7a73a2c351536
common_voice_mn_25129018.wav	Ноход нь ч бас ердийн л биетэй ноход байлаа.	e27bd61bb81f01132661ff76f105d9cb728a1115085cdb38827f436f47e3ac9d
common_voice_mn_40169236.wav	Гэтэл өсгийтэй гутлын чимээ гаран эсрэг талын өмгөөлөгч гэрчийн дэргэд очин зогслоо.	65d447157871c4066776fc2ebcc8a1d9188a15a96cfa88ccb033d81451592ce6
common_voice_mn_19521051.wav	Манайх хотод байж байгаад Дарханд ирсэн юм л даа гэв.	6849410db46373df51b0f855a7bec9a0b6c0c4b99c4a531049e7243879af5aca
common_voice_mn_18667731.wav	Би хаягийг чинь мэдсэнээс хойш сүүлд захиа бичимз гэж хэлээд гар даллан хоцров.	0596b96e48ba02273ab6f423395daadd349bda42297db47370fb130191e14a81
